{
  "schema_version": "2.0",
  "video_id": "b2b4-runpod",
  "episode_content_hash": "b79aab4a4d27cec3c2fed13579185a12f0d9f0e4de383b25aab8927eba6fa0b6",
  "passes": [
    {
      "pass_id": "conceptual-completeness",
      "status": "pass",
      "checks": [
        "hook, promise, prerequisites, definition, worked example, mechanism, contrast, boundary, retrieval, misconception repair, recap present",
        "owned concepts and exclusions match the bible"
      ]
    },
    {
      "pass_id": "script-to-visual-alignment",
      "status": "pass",
      "checks": [
        "every cue maps to a scene and unique timed state change",
        "all visual beats last at most eight seconds",
        "composition and meaningful-state budgets met",
        "no passive three-box direction"
      ]
    },
    {
      "pass_id": "evidence-claim-audit",
      "status": "pass",
      "checks": [
        "all factual cues bind allowed claims",
        "claim sources include exact locators and hashes",
        "conceptual examples are visibly labeled"
      ]
    }
  ],
  "word_count": 712,
  "chapter_count": 3,
  "scene_count": 15,
  "beat_count": 78,
  "duplicate_spoken_cues": 0,
  "generic_filler_cues": 0,
  "duplicate_state_changes": 0,
  "maximum_visual_beat_seconds": 7.001,
  "unresolved_claim_ids": [],
  "placeholders": [],
  "content_hash": "e637f3691514a8682f1d4730e644d87fde84b97c67643fd05fcfcf4efe77a962"
}
